" can occur in patients with pre-existing asthma, cystic fibrosis; compare to an asthma attack, where this is ALSO associated with fever, malaise, x-ray infiltrates",Allergic bronchopulmonary aspergillosis
 most chemical carcinogens enter the body in an inactive state (pro-carcinogens); they are converted to active metabolites via the cytochrome P450 oxidase system,Carcinogens
 pseudopalisading necrosis shows up as a foci of necrosis (no nuclei) surrounded by tumor cells; does not have to be linear,Glioblastoma multiforme
" arises from C3-C5, also associated with referred shoulder pain, hiccups when irritated",Phrenic nerve
" can cause spongiform encephalopathy, which can also be described as large intracytoplasmic vacuoles",Prion diseases
 4 - 5 half-lives,Time to reach steady-state with continuous infusion
 the major adaptive immune mechanism that prevents infection is via anti-hemagglutinin (anti-HA) antibodies,Influenza
" pentad of features which include fever, neurologic symptoms, renal failure, anemia, and thrombocytopenia in the setting of GI illness; NEUROLOGIC FEATURE CAN PRESENT SIMPLY AS FATIGUE",TTP-HUS or thrombocytopenic thrombotic purpura - hemolytic uremic syndrome
" gram-possitive cocci in pairs AND CHAINS; associated with gamma hemolysis (no hemolysis); also include pyrrolidonyl arylamidase (PYR) positivity; compare to staph, which grows in clusters",Enterococcus
" most common benign lung tumors; comprised of disorganized cartilage, fibrous, adipose tissue",Hamartomas
" most common malignancy associated with asbestos exposure, whereas mesothelioma is second most common",Bronchogenic carcinoma
 can cause gallbladder colic via mu-receptor activation of smooth muscle cells at the spinchter of Oddi,Opioids
" toxin can result in dysphagia and dysphonia as well, AND anti-cholinergic blockade effects (dry mouth, mydriasis)",Clostridium botulinum
 VERY LOW of risk inducing torsades de pointes despite the fact that it prolongs the QT interval,Amioderone
" associated with keratinization / keratin pearls, and intercellular bridges; poor prognosis",Esophageal squamous cell carcinoma
" repeated mild attacks cause thickening of the gallbladder, resulting in a shrunken, fibrosed gallbladder",Chronic cholecystitis
 chorioretinitis can be an in-utero complication of infection,CMV
" some strains do not have a capsule; given the vaccine is for a encapsulated strain only, these strains are still infectious in vaccinated individuals",Haemophilus influenzae
" adult onset is the most important poor prognostic factor; 60% of adult cases resolve completely, leading to chronic renal issues or rapidly progressive glomerulonephritis",Poststreptococcal glomerulonephritis
 morphology can be described as pseudohyphae with blastoconidia; associated with catheters,Candida
" a proxy measure of pulmonary blood pressure; is higher in cardiogenic pulmonary edema, is normal in ARDS",Pulmonary capillary wedge pressure
 associated with islet amyloid polypeptide deposition in the pancreas,Type 2 diabetes mellitus
 NOT associated with DKA; which is associated with T1DM individuals not taking insulin,Type 2 diabetes mellitus
" progressive damage to cerebellum (and associated symptoms of ataxia, dysarthria, visual disturbances) due to autoimmune cross-reactivity with a tumor and Purkinje neuron antigens; Anti-Yo, P/Q, Hu antibodies are most common but not always detectable",Paraneoplastic cerebellar degneration
 occurs in diabetes mellitus that is symmetric and starts in the feet; does not occur as often in the hands and does not often occur with high blood pressure,Endoneural arteriole hyalinization
" affects thumb, index, middle fingers, with radial half of ring finger, AKA first 2u1/2 digits, AKA median nerve distribution",Carpal tunnel syndrome
" (+) for tinel sign, which is when tapping on the wrist causes symptoms; (+) for phalen sign, which is when flexion of the wrist causes symptoms",Carpal tunnel syndrome
" associated with thenar atrophy, motor weakness during thumb abduction/opposition",Carpal tunnel syndrome
" normally present in the cytoplasm in its inactivated state, bound to IkB; LPO and other activators can start a signal cascade to degreade IkB and translocate the transcription factor into the nucleus",NF-kB
" associated with stasis dermatitis, skin ulceration, poor wound healing, infection, hyperpigmentation",Varicose veins
" in addition to outside factors such as lead, lithium, and chronic analgesic use, this can be caused by sickle cell disease OR TRAIT, diabetes, or obstructive pyelonephritis",Renal papillary necrosis
" mullberry-like due to purple vascular clusters; histologically, can be seen as vascular proliferatio nwith lakes of red blood",Cavernous hemangiomas
" also associated with ipsilateral posterior cerebral artery compression, leading to contralateral homonymous hemianopsia with macular sparing",Transtentorial / uncal herniation
 associated with hepatocellular carcinoma due to p53 mutations,Aspergillis aflatoxins
 not associated with PE; only thrombophlebitis due to only affecting the superficial veins,Varicose veins
" associated with small cell lung, breast, uterine, ovarian, cancer",Subacute cerebellar degeneration
 affects the spinocerebellar and dorsal column tracts most,Friedrich's Ataxia
" in multiple myeloma, it prevents breakdown of anti-apoptotic proteins resulting in plasma cell apoptosis",Proteasome inhibitor
" hyphae can be described as ""septate with dichotomous branching""",Aspergillis
 not always associated with the face rash; can just appear as generalized weakness,Parvovirus
" histologically, simple cuboidal cells to rapidly repair",Ovary
 3 female GI structures that have simple columnar epithelium,"Fallopian tube, uterus, endocervix"
" histologically, stratified nonkeratinized epithelium",Ectocervix
 involves complete destruction of tissue; including lysosomal digestion,Liquefactive necrosis
" AR mutation that can prevent with situs inversus, chronic sinusitis, bronchiectasis, infertility",Primary ciliary dyskinesia
" associated with spongiosis, a Type IV hypersensitivity reaction where edema fluid flows between the cells of the epidermis",Eczema
" complete or partial loss of epidermal melanocytes; usually by 30 yrs, macules and patches few to tens of cm",Vitiligo
" when mild, can improve with age due to presbyopia",Myopia
 when image focuses in front of the retina,Myopia
" occurs with age, results in an image the focuses behind the retina by limiting accommodation",Presbyopia
" occurs with normal aging, with a contribution from UV sun exposure",Skin wrinkles / rhytides
 encodes for a human epithelial growth factor with tyrosine kinase activity in the intracellular domain; overexpression is associated with worse prognosis and reoccurance,Her2 oncogene
 can be multiple on the eyelid; initial step in management once present includes labs for lipids and glucose to rule out diabetes and specific dyslipidemias,Xanthelasmas
" often associated with high levels of IgE, peripheral eosinophilia; can often be paired with allergic rhinitis and asthma; can be triggered with certain environmental OR INGESTED antigens (exposure is key)",Atopic dermatitis
" red, weeping / crusted lesions, spongiosis; compare with dermatitis herpatiformis, which presents as clusters of pruritic vesicles and plaques on the buttocks and extensor surfaces of the extremities, also presents during 40 to 50 yr and rare in childhood",Atopic dermatitis
" can present as a long (e.g. 2 year) history of steatorrhea, assoc with abdominal discomfort and weight loss",Whipple disease
" on X-ray, shows as enlargement of the pulmonary arteries and the right ventricle",Primary pulmonary hypertension
" pancreatic insufficiency can result in obstruction, inflammation, subsequent fibrosis and calcification",Cystic fibrosis
 requires social and occupational impairment,All psychiatric disorders in DSM-V
 physicians are justified to obtain one if their medical decisions are challenged in cases where a child is at significant risk for harm,Court injunction to continue treatment
 responsible for release of serotonin in the brain,Raphe nuclei
 responsible for releasing norepinephrine that is used in the fight or flight response,Locus ceruleus
 indicated in specific phobias; includes systematic desensitization therapy,Behavioral therapy
 aims to develop insight into unresolved conflicts in childhood,Supportive psychotherapy
 acknowledge the trauma and communicate willingness to discuss about it when the patient is ready,Physician response to trauma
" psychotic symptoms occur exclusively during mood episodes; compare to schizoaffective disorder, where psychosis must occur in the absence of major mood episodes",Bipolar disorder with psychotic features
 moreso associated with loss than just sadness; also often intermixed with positive memories; decreases in intensity over time,Normal grief
" not ethical, should be reserved to emergencies only",Performing informal medical treatment on friends
 ethically problematic to do so as they my or even APPEAR to influence physician behavior; should always be declined and thanked,Accepting gifts as a physician
" excessive anxiety and pre-occupation with >=1 unexplained symptoms; compare to illness anxiety disorder, where there is few to 0 symptoms with preoccupation of serious illness",Somatic symptom disorder
 assumes the sick role through falsification or INDUCING symptoms (e.g. fecal innoculation leading to induced cellulitis),Facetious disorder
 neurologic symptom incompatible with neurologic disease; acute onset due to stress,Conversion disorder
" can present with ""deliberately annoying others"" in addition to opposing rules and authority; compare to conduct disorder, which often presents with severe and aggressive behavior of basic rights such as animal cruelty, destruction of property, and stealing",Oppositional defiant disorder
" in a non-medical setting, a physician should neither confirm or deny whether the person of interest is actually a patient",Patient confidentiality
 physician has a responsibility to make a thorough assessment before determining if a patient is eligible,Demanding patients who request a benefit
" patients should be assessed when sober, a psychiatric hold is for patients with more severe underlying mental illness (e.g. acute risk to self or others, unable to obtain food, shelter after sobriety)",Drunk difficult patient
" NMDA receptor ANTAGONIST; can also limit reuptake of norepinephrine, dopamine, serotonin",Phencyclidine (PCP)
 associated with disinhibition of behavior,Right-sided frontal lobe lesions on right-handed individuals
" associated with dominant lesions of the parietal lobe; presents with right-left confusion, writing and mathematics difficulties",Gerstmann syndrome
" associated with hemi-neglect, denial of the problem",Non-dominant parietal lobe lesions
" symptoms typically peak at 5 days and resolve in 10; if longer, likely postpartum depression (> 4wks); if thoughts of harm are present, likely postpartum psychosis",Postpartum-blues
 associated with both physical AND vocal tics for >1yr; vocal tic can present as throat clearing,Tourette syndrome
 can present as a child angry about a divorce acting quiet because he believes that they are angry at them; often occurs in individuals who lack insight into their own feelings,Projection
 highly sedating anti-depressant that can be used to treat insomnia; assoc with priapism,Trazodone
 >1 mo &amp; <6 mo with schizophrenia symptoms; but functional decline not required,Schizophreniform disorder
" >= 1 delusions >1 mo, NO OTHER psychotic symptoms",Delusional disorder
 Bipolar I vs II; 1 has severe manic episodes; 2 has hypomanic episodes without marked impairment,Bipolar disorder
 associated with hypnopompic or hypnagogic hallucinations; sleep paralysis,Narcolepsy
 can refuse medical information; physicians must respect beliefs of cultures that value beneficence and nonmaleficence over autonomy,Patient refusals
" assoc with conjunctival injection, tachycardia, increased appetite, dry mouth",Marijuana intoxication
 allows patients to see providers out-of-network for a slightly increased fee,Point-of-service
" determined by 4 things: communicating a choice, understanding information, appreciating consequences, and has a rationale",Decision making capacity
 requires collaboration; a social worker can assess whether or not a patient has adequate family or caregiver at home,Effective discharge planning
 can help improve medication adherence,Simplifying dosing schedule
 assess patient ability to retain information and follow a checklist,Cognitive impairment and medical discharges
 should be addressed in the hospital admission process if the patient has a high risk of becoming incapacitated soon,Advance care planning
" acute onset, secondary to other conditions (e.g. infection, drugs, metabolic derangements, CNS issues)",Delerium
" 200 word vocabulary; with 6 cube stacking, parallel play",Age 2
 normal for children to see hallucinations < 6 mo,Hallucinations and grief
" lysyl oxidase (requires copper) oxidatively deaminates lysine residues, forming desmosine cross-links; these crosslinks allow for the rubber-like properties of this fibrous connective tissue protein",Elastin
 substrate concentration at which half of the enzyme's binding sites are occupied by substrate (1/2 Vmax),Michaelis constant (Km)
" can create 2,3-BPG via a glycolysis shunt from 1,3-BPG; this bypasses an ATP-generating step of glycolysis, resulting in no net gain of ATP",Erythrocytes
" produced from biphosphoglycerate mutase and 1,3-BPG; only present in RBCs / erythrocytes","2,3-BPG"
" is produced with succinate thiokinase, which converts SuccCoA to Succinate",GTP in Krebs cycle
" produced with succinate dehydrogenase, which converts Succ to fumarate",FADH2 in Krebs cycle
" for gluconeogenesis, catalyzes conversion of oxaloacetate to PEP, is one of the few GTP hydrolyzing enzymes",Phosphoenopyruvate carboxykinase
" produced during conversion of isocitrate to alpha-ketoglutarate, alpha-ketoglutarate to SuccCoA, and Malate to oxaloacetate",NADH in krebs cycle
" can present via an acyl-CoA dehydrogenase deficiency, which normally allows modification of carnitine to start fatty acid beta-oxidation",Hypoketotic hypoglycemia with fasting
" crosses the blood brain barrier, and causes excessive glutamine to accumulate within astrocytes and causing them to swell, impairing glutamine transfer it from glutamate production in neurons, resulting in disuption of excitatory neurotransmission",Hyperammonemia in advanced liver failure
" where glutamine is released by astrocytes to be taken up by neurons, which then use it to synthesize glutamate as an excitatory neurotransmitter",Glutamate-glutamine cycle
 allows tissues that use amino acids as fuel to shunt excess nitrogen to liver,Glucose-alanine cycle
 Hb A > Hb S > Hb C on gel electrophoresis; associated with a missense mutation on the beta globin chain,Hemoglobin C
" on the 3' end, sticks out relative to the 5' end which allows tRNA synthetase to bind to the tRNA",tRNA acceptor stem
 facilitates tRNA recognition by the proper aminoacyl tRNA synthetase,tRNA d-loop
 facilitates tRNA binding to ribosomes,tRNA t-loop
 enzyme found in adipose that mobilizes FFAs and glycerol during fasting for gluconeogenesis and ketones,Hormone sensitive lipase
" useful activator of carbamoyl phosphate synthetase, useful for urea cycle",N-acetylglutamate
" from poisonous mushrooms, concentrate into hepatocytes and bind DNA-dependent RNA polymerase II, which stops mRNA synthesis",Amatoxins
" inhibits protein synthesis by cleaving the rRNA component of eukaryotic 60s ribosomal subunit, from castor oil plant",Ricin
 transcribes eukaryotic ribosomal RNA components,RNA polymerase I
" transcribes tRNA, small RNA molecules",RNA polymerase III
" only bacterial DNA polymerase with 5' to 3' exonuclease activity, allowing it to run over / remove RNA primers",DNA polymerase I
" bacterial DNA polymerase with 5' to 3' polymerase activity, and 3' to 5' exonuclease activity",DNA polymerase III
" while T-cells prevent superficial Candida infection, NEUTROPHILS prevent hematogenous spread of Candida",Candida
" most common cause of male hypogonadism; destruction of seminiferous tubules remove inhibin, which limits feedback inhibition of FH, LSH, destruction of leydig cells too",Klinefelter syndrome
" XXY, can present with longer limbs, gynecomastia in a male (due to excess aromatase activity via HIGH FSH/LH) and small, firm testes",Klinefelter syndrome
" can face severe hypotension, acute pulmonary edema, due to sudden loss of normal atrial contraction",Aortic stenosis
" can occur alone or as a paraneoplastic syndrome (e.g. ovary, lung, GI, non-hodgekin lymphoma)",Dermatomyositis
" while increased sodium absorption would be present, hypernatremia is rarely seen due to aldosterone escape (pressure naturesis + ANP); resulting in normal sodium",Hyperaldosteronism
 occurs because alpha-intercalated cells secrete excessive hydrogen,Metabolic alkalosis in hyperaldosteronism
 can present with a bounding pulse and a brisk upstroke due to increased LV ejection volumes,Severe mitral regurgitation
 requires increased diastolic filling pressure from the left atrium,Left sided heart failure
" individuals with this disease are also prone to developing primary adrenal insufficiency, Graves disease, Hashimoto's thyroiditis",Type I diabetes mellitus
" stimulates the formation of phagolysosomes, NO release, and the development of granulomas and caseous necrosis",IFN-gamma
 stimulates natural killer (NK) cells to destroy target cells; also helps Th cells secrete IFN-gamma,IL-12
 directly responsible for tissue damage and setting the stage for abscess formation,Lysosomal enzyme release
" can be caused by stress; characterized by severe hypotension, abdominal pain, vomiting, weakness, and fever",Adrenal crisis
 modified smooth muscle cells with renin-containing zymogen granules; located on the wall of the afferent arteriole,Juxtaglomerular cells
 primary site of uric acid precipitation because of low urine pH,Renal Collecting ducts
 associated with hyponatremia due to excessive salt wasting from sweat (has high Na Cl levels),Cystic fibrosis
 associated with a delta-F508 mutation,Cystic fibrosis
" can also involve thoracic spine and costovertebral, costosternal junctions, limiting chest wall expansion; degree of chest expansion should be monitored",Ankylosing spondylitis
" can present with polyuria, due to high blood sugars (>250 mg/dL)",Osmotic diuresis
 can be due to loss of CNS inhibition of detrusor contraction in the bladder; in this state it is atonic and dilated,Incontinence
 associated with INCREASED lung capacity and residual capacity,Emphysema
" typically presents as lobar infiltrate with foul-smelling sputum, dyspnea, fever",Aspiration pneumonia
" inhibits the krebs cycle by using up free NAD+ to form NADH; particularly at conversion from pyruvate -> ACoA, and alpha-ketoglutarate to SuccCoA",Ethanol
" when cells within the heart, brain, or skeletal muscle are damaged, the enzyme creatine kinase leaks across the cell membrane into circulation",Reperfusion injury
 diagnosis is purely clinical; there is no serum toxin test or antibody test for this bacterium,Tetanus
 limits infarction due to collateral blood flow supplied by pulmonary and bronchial arteries,Dual blood supply of the lung
 onset is usually clinically silent,Hepatitis C
" onset is usually similar to a serum sickness-like syndrome with joint pain, lyphadenopathy, pruritic urticarial vasculitis rash",Hepatitis B
" if abnormal, can highlight deficits in the intrinsic coagulation pathway (all factors excluding factor X and below, factor 7)",aPTT
" can be treated with estrogen receptor modulators, which can decrease feedback inhibition on the hypothalamus by circulating estrogen, increasing GnRH",Infertility in polycystic ovary syndrome
" combination OCPs work by suppressing LH secretion from the pituitary, decreasing ovarian androgen production",Polycystic ovary syndrome
" can cause a combined aortic stenosis and regurgitation, both of which increase LV diastolic pressure",Rheumatic heart disease
 occurs when the lung is poorly ventilated but well-perfused,Intrapulmonary shunting
 does not cause acute symptoms,Hepatic steatosis
" while good for Legionella and P. aeruginosa, not effective vs. anaerobic infections",Ciprofloxacin
" extended spectrum with beta-lactamase inhibitor, therefore good against most gram-negative enteric rods (including Pseudomonas)",Piperacillin-Tazobactam
 occurs when one hormone allows another to exert its maximal effect,Permissiveness
 describes decreased drug responsiveness in a short period following one or more doses,Tachyphylaxis
" associated with prominent physical signs, lack of psych history, temporal association",Substance-induced psychotic disorders
 only form in renal tubules due to precipitation with Tamm-Horsfall protein secreted by tubular epithelial cells,White blood cell casts
 hormone that mediates gallbladder hypomotility in pregnancy,Progesterone
 low gonadotropin releasing hormone FSH LH and consequently either testosterone or estrogen can simulate menopause,Prolactinoma
" histologically, can present with prolonged downward Awakenings between the dermal papillae called rete ridges",Psoriasis
" can occur w/ vasculitis, often reveal a cherry red spot on fundus with surrounding white area due to ischemia without hemorrhage",Central retinal artery occlusion
" associated with acute headache, eye pain, vision loss; fundus shows cupping of optic disc without hemorrhage",Closed-angle glaucoma
" can be caused by uncontrolled hypertension; can present with flame or dot hemorrhages, as well as cotton-wool spots",Acute retinal hemorrhage
" associated with increased glomerular celluarity, ""proliferative = cell count""",Proliferative glomerulonephritis
" can present as an esophagitis, usually in immunocomprimised; associated with small shallow ulcers; histologically, multinucleated giant cells with cowdry bodies",HSV
 similar auscultation as aortic stenosis - a harsh crescendo decrescendo systolic ejection murmur heard best in the right 2nd parasternal space with radiation to the carotids; can occur with an early systolic ejection click,Bicuspid aortic valve
 moderate increase in capillary fluid transudation can be offset by compensatory increase in tissue lymphatic pressure,COPD / emphasema
 an indirect estimate of left atrial pressure,Pulmonary capillary wedge pressure
" associated with increased left atrial pressures throughout the cardiac cycle (e.g. increased preload, increased afterload)",Mitral stenosis
 is due to an accessory pathway that bypasses the AV node and directly connects the atria and ventricles,Wolf-parkinson-white
 cardiac myocyte degeneration below the level of the AV node,Conduction block
 can present as abnormal nonuniform P-waves on ECG,Ectopic atrial rhythm
" resultant motion can be described as ""systolic anterior motion of the mitral valve""",Hypertrophic cardiomyopathy
" can present with progressive dyspnea or exhaustion, due to increasing compensatory / remodeling mechanisms at play",Congestive heart failure
 selective vasodilators of coronary vessels can worsen flow in ischemic areas (e.g. dipyridamole and ADENOSINE),Coronary steal
" pain in this condition is not only relieved when leaning forward, but also sitting up",Acute pericarditis
 can take years of restrictive cardiomyopathy to develop this sign,Kussmaul's sign
 paradoxical increase in JVP with inspiration; also associated with tricuspid stenosis,Kussmaul's sign
" associated with normal left ventricular ejection fraction, normal left ventricular end-diastolic volume, and elevated LV filling / possible filling defects",Diastolic heart failure
" associated with increased pulmonary pressure leading to Eisenmenger syndrome; if corrected, heart can revert to normal morphology",Atrial septal defect
 can present with coronary sinus dilation secondary to this condition due to elevated right sided heart pressure,Pulmonary hypertension
" despite the continuous murmur heard best at the left infraclavicular region, a small one is usually asymptomatic",Patent ductus arteriosis
" stroke volume increases with myocardial stretch, at all times",Frank-Starling mechanism
" can be treated with tools that increase the ratio of forward to regurgitant blood flow; e.g. while left atrium pressures remain constant, systemic vascular resistance can be reduced",Mitral regurgitation
" associated with death by profound hypotension, usually within 14 days of an MI",Ventricular free-wall rupture
" on auscultation, occurs right before S1",S4 heart sound
 galloping heart sound that can be present in healthy older adults,S4 heart sound
 galloping heart sound that can be present in Age <40 and pregnancy,S3 heart sound
" heart sound occurring immediately after S2; commonly associated with increased ventricular end-systolic volume (e.g. mitral regurgitation, systolic heart failure)",S3 heart sound
" normal process in aging, associated with psammoma bodies in the necrotic tissue (dystrophic calcification)",Calcific aortic stenosis
 a tracing that is most sensitive to atrial contraction,Jugular venous pressure
" referring to the jugular venous tracing, the section of the diagram associated with passive emptying of the right atrium in early diastole",Y-descent
 low cardiac output but NOT ASSOCIATED WITH PULMONARY EDEMA,Isolated right ventricular dysfunction
" associated with lower left-sided filling pressure, thus lower PCWP",Isolated right ventricular dysfunction
