" fusobacterium, bacteroides, prevotella, peptostreptococcus, most commonly cause this condition; associated with states of altered consciousness",Lung abscess
" despite this continued process, pH of blood becomes near normal due to renal bicarb compensation within 24-48 hours",Hyperventilation
" instead of beta-globin gene mutation; can also be caused by defective transcription, processing, and translation of beta-globin mRNA",Beta-thallasemia
" increased in residual volume due to diminished elastic recoil, but without concomitant increase in total lung capacity because decreased chest wall compliance; FVC increases due to RV being a larger portion of TLC",Pulmonary function in aging
 binds reversibly to Hb at very high affinity; hence hyperbaric O2 is a therapy,CO
 globin chain denaturation via sulfydryl linking with high oxidation,G6PD
" look for gravida and para numbers; occurs in subsequent pregnancies; can present with newborn Coombs (+), jaundice, anemia, hydrops fetalis, compansatory extramedullary hematopoiesis",Hemolytic disease of the newborn
" mesolimbic, mesocortical, tuberoinfundibular, nigrostriatal",Major dopaminergic pathways of the brain
 associated with Parkinsons; movement,Nigrostriatal dopaminergic pathway
 pathway associated with regulation of the anterior pituitary's prolactin release,Tuberoinfundibular dopaminergic pathway
" brain pathway associated with psychosis, negative symptoms of schizophrenia, if damaged",Mesocortical dopaminergic pathway
" dopaminergic pathway associated with reward; physically associated with ventral legmental area, nucleus accumbuns, olfactory tubercle",Mesolimbic dopaminergic pathway
" associated with either impaired detrusor activity (e.g. inability to sense a full bladder in uncontrolled diabetes), or bladder outlet obstruction (e.g. tumor obstructing urethra); typically present with involuntary or continuous leakage",Overflow incontinence
" divided into overflow, stress, and urge",Incontinence
 increased abdominal pressure causes brief involuntary urine loss,Stress incontinence
" detrusor overactivity that causes a frequent urge to urinate; can be triggered by events such as washing hands, running water, exposure to cold weather",Urge incontinence
 normally used for the upper arm; anesthetic administered in the scalene triangle is associated with transient ipsilateral diagphragmatic paralysis from phrenic nerve block,Interscalene nerve block
" ST elevations in I and avL refer to lateral limb leads, which indicate infarction of the upper lateral left ventricle, supplied by this artery",Left circumflex
 ST elevations in anterior chest leads V1-V4 result in this ECG reading,Left anterior descending occlusion
 occlusion of this vessel results in ST elevations in the anterior chest leads V2-V4,Distal left anterior descending (LAD) occlusion
" because it gives off both left anterior descending and left circumflex, in occlusion, you get an ECG of ST elevations in V1-V4, and V5-V6, I, avL, respectively",Left main coronary artery
" secretion is also mediated by thyrotropin, but isn't TSH",Prolactin secretion
" gyrus repsonsible for motor action; compare to *postcentral gyrus*, which is responsible for sense in corresponding areas",Precentral gyrus
 most commonly broken wrist bone with an outstretchred wrist; associated with avascular necrosis; pain in anatomical snuffbo,Scaphoid bone
 can be caused by injury with a lunate dislocation,Carpal tunnel syndrome
" small, sac-like structure in heart that is highly vulnerable to thombus formation (e.g. 90% of nonvalvular atrial fibrillation)",Left atrial appendage
" can be divided into 3 kinds, merocrine, apocrine, and holocrine",Types of exocrine glands
" exocrine glands that secrete their products via exocystosis (salivary, sweat)",Merocrine glands
 exocrine glands that secrete their products by membrane-bound vesicles (e.g. mammary),Apocrine glands
" exocrine glands that secrete their products by cell lysis (sebaceous, meibornian aka eye tear film from lid)",Holocrine glands
" can cause significant upper GI bleeding following the penetration of the duodenal bulb, usually due to acid causing ulceration",Posterior duodenal wall penetration
" courses superior to the pancreas, posterior to the stomach, and gives out branches to the short gastric arteries while on its way to the spleen",Splenic artery
" have poor anastamoses with the other gastric arteries, can get infarcted with splenic artery blockage",Short gastric arteries
" from the celiac trunk, this artery divides into the hepatic proper artery and the gastroduodenal artery",Common hepatic artery
" common thrombosis through contiguous spread of infection from medial third of face, ethmoid or sphenoid sinuses, or teeth; this is due to its valveless nature",Cavernous sinus thrombosis
" can present with injury to CN III, CN IV, CN VI, preventing eye movement while sparing acuity; also with proptosis or chemosis due to impaired venous drainage",Cavernous sinus thrombosis
 most common area injured in the male GI during pelvic trauma due to lack of supportive tissue,Bulbomembranous junction of posterior urethra
 this muscle's tendon is most commonly affected in rotator cuff syndrome; due to impingement of the tendon between the head of the humerus and the acromion,Supraspinatus
" action can be isolated by the ""empty can"" test; where patient abducts the humerus in parallel to axis of scapula (30 degrees forward flexion) with full pronation (thumb to floor)",Suprspinatus
 injury to this muscle usually manifests as sudden-onset shoulder pain after overloading arm while in abduction,Deltoid injury
" this bone is prone to injury, usually a hairline fracture that becomes worse with gripping, due to its tenuous blood supply; compare with hook of this bone injury, which damages the nerve that runs through Guyon's canal",Hamate
" commonly occurs due to repetitive pronation / supination (e.g. screwdriver use), direct trauma, subluxation of the radius; commonly presents with finger/thumb extension without sensory deficits",Radial nerve injury at supinator canal
" injury of the wrist at this fibroosseous tunnel would lead to weakness on finger adduction/abduction, wrist adduction/abduction, and clawing of 4th and 5th digits; aka hook of hamate injury",Ulnar nerve injury at Guyon's canal
" can be divided into the superficial, which follows veins, and the deep, which follows arteries",Lymphatic system
" in the lower limbs, can be divided into the lateral and medial; of which the medial bypasses the popliteal towards the inguinal via tracking with the great saphenous vein",Superficial lymphatic system
 lymph from this male GU organ primarily drains into the internal iliac lymph nodes,Prostate
 lymph from these male GU structures primarily drains into the superficial inguinal lymph nodes,"Scrotum, skin of penis"
" done 2 ribspaces below lung parenchyma because the pleura extends down 2 ribspaces; performed at the 8th rib at the midclavicular line, 10th rib at midaxillary line, and 12th rib along paravertebral line (posterior)",Thoracentesis
 provides an anastamosis of blood flow from the superior mesenteric artery with the inferior mesenteric artery,Marginal artery (of Drummond)
" when it affects the oculomotor nerve, its due to direct mass effect and NOT herniation; generally due to location between posterior cerebral and superior cerebellar arteries",Berry aneurysms
" can be caused by bulging intervertebral disc, hypotrophied vertebral facet, or a thickened ligamentum flavum",Spinal stenosis
" presents as lower-lumbar pain, parasthesias, numbness that is posture dependent; most commonly caused by degenerative arthritis of the spine",Spinal stenosis
" associated with ""shopping cart sign"" where back pain is relieved with leaning forward on a shopping cart instead of standing straight",Spinal stenosis
" SAD PUCKER aka-  suprarenal glands, aorta, duodenum (2nd,3rd parts), pancreas, ureters, colon, kidneys, esophagus, rectum (mid-distal)",Retroperitoneal organs
" bursa above the patella, compare to pre-patellar, which commonly gets injured with kneeling-work",Suprapatellar
 associated necrosis of the putamen and other basal ganglia structures,Wilson's disease
" reflex mediated by the glossopharyngeal and vagus nerves (CN IX, CN X)",Gag reflex
" if deviated, it is towards the normal side (which maintains tone)",Uvula deviation
" if deviated, it is towards the side with the lesion",Tongue atrophy deviation
 diagnosed by joint-line tenderness while the knee if flexed,Meniscal injury
 injury of this knee meniscus and ligament usually occur together,Medial cruciate ligament (MCL) and medial meniscus injury
" innervated by the posterior cord of the brachial plexus (C6-C8), the thoracodorsal nerve, and assists with arm extension, adduction, internal rotation",Latissimus dorsi
" innervated by CN XI, commonly injured in whiplash injuries",Trapezius
 double layer of peritoneum that extends from the liver to the lesser curvature of the stomach and beginning of the duodenum,Lesser omentum
 is divided into hepatogastric and hepatoduodenal ligaments,Lesser omentum
 visceral peritoneum that connects the stomach with the transverse colon,Gastrocolic ligament
" these ""false"" ribs can lacerate kidneys if fractured; the kidney lies immediately deep to the latter","11th, 12th ribs"
 this structure is near the septal leaflet of the tricuspid valve and the orifice of the coronary sinus,AV node location
 name of the foramen ovale once closed,Fossa ovalis
 this structure is near the upper right anterior right atrium near the entry of the superior vena cava,SA node location
" a fasiculus that connects Broca's and Wernicke's areas; damage results in conduction aphasia (intact speech, understanding but IMPAIRED REPTITION)",Arcuate fasiculus
 can be associated with high TRH causing hyperprolactinemia,Hypothyroidism
" D-dimers within normal range, despite kidney dysfunction and elevated intravascular hemolysis",Hemolytic uremic syndrome
 associated with gallstones because bile acids are lost in feces; bile acids are normally reabsorbed to prevent cholesterol supersaturation,Crohn's disease
" hypersensitivity vasculitis associated with penicillin intake; small vessel vasculitis that presents with non-blanching palpable purpura; histologically, neutrophilic infiltrate + fibrinoid necrosis of small vessels",Leukocytoclastic vasculitis
 another name for IGF-1,Somatomedin C
" while this hormone has the effect of promoting bone growth, it also has the effect of closing epiphysial plates, which results in shorter stature despite an initial growth spurt",Estrogen / Sex hormones
 can simply present as painful swelling in hands and feet,Dactylitis
" normally expressed on surface of activated T-cells to act as a inhibitory switch; cancer cells can express it's ligand, PD-L1 to inhibit T-cells",PD-1 / programmed death receptor 1
" assoc with high mortalitity from fulminant hepatitis in pregnant women; it is an unenveloped, single-stranded RNA virus that is spread through fecal oral route",Hepatitis E
" hyperkeratosis, biliary obstruction, night blindness ""near misses while driving at night""",Vitamin A deficiency
" endogenous hormones that preferentially constrict the efferent arteriole, increasing GFR","Angiotensin II, BNP, ANP"
" along with T-cell receptor, interacts with B cell B7 to activate t-cells",CD-28
" mediates G1 to S progression; present in two forms, active / hypophosphorylated, and inactive / hyperphosphorylated; active results in binding to E2F transcription factor, rendering it inactive and preventing S-phase from occuring",Retinoblastoma (Rb)
"  histologically, presents with microabscesses containing neutrophils and fibrin on dermal papillae; involves formation of IgA antibodies against gliadin, same as celiac disease",Dermatitis herpatiformis
 presents during 40s and 50s bilaterally and symmetrically on extensor surfaces,Dermatis herpatiformis
" can present with lacy erythematous rash below face following a fever, like HHV-6; reproduces in erythrocyte precursors, which can contribute to aplastic anemia",Parvovirus B19
" reproduces within mature intestinal epithelial cells, which slough off after and result in profuse watery diarrhea",Rotavirus
" antibody-immune complexes, while not directly responsible for causing liver damage, can cause early and late signs (e.g. arthralgias, urticaria, and glomerulonephritis, vasculitis respectively)",Hepatitis B infection
 severity of the disease is highly associated with systemic IL-6 levels,Giant cell arteritis
" in this process oxygenated blood from placenta enters towards the liver via IVC, which is then delivered to the heart; deoxygenated blood is delivered via umbilical arteries; blood bypasses lungs through ductus arteriosus",Fetal circulation
 can present with sulfur granules in bronchi following aspiration of bacteria,Actinomyces israelii
 metabolized into methionine (via a B12 dependent process) or cysteine (via a B6 dependent process),Homocysteine
" a sheet of peritoneum that can be broken down into 3 structures- mesosalpinx (fallopian tube to ovary), mesoovarium (fallopian tube to ovary, buf inferior to mesosalpinx), mesometrium (medial to ovary)",Broad ligament
" aka infundibulopelvic ligament, lateral to the ovaries and attaching the ovaries to the abdominal sidewall, this ligament contains the ovarian ovary, vein, lymphatics, and nerves; damage to this can result in ovarian infarc",Suspensory ligament of the ovary
 analogous to the spermatic cord in males; this ligament in females also courses through the inguinal canal,Round ligament
 band of connective tissue and smooth muscle that connects the ovary to the side of the uterus medial to the fallopian tubes; does not contribute vasculature,Ovarian ligament
 aka transverse cervical ligament; connects the cervix and lateral fornix of the vagina to the pelvic walls,Cardinal ligament
" occurs when the superior mesenteric artery is occluded; resulting in blind-ended proximal jejunum, length of absent bowel and mesentery, and terminal ileum spiraled around an ileocolic vessel",Apple peel atresia
" can be used to determine chances of having a genetic disease if disease prevalence, allele frequency, or carrier frequency with either normal or diseased allele frequency is known",Hardy Weinberg analysis
" androgenic alopecia, epilepsy, glaucoma, hypertension, ischemic heart disease, schizophrenia, T2DM all share this kind of inheritance",Polygenic inheritance
" think ""acetylate = activate""; this process enables DNA to stay in heterochromatin instead of euchromatin)",Histone acetylation
 bodies of hyper-de-acetylated DNA of condensed heterochromatin due to X-inactivation,Barr bodies
" good pharmacotherapy for long term prevention of asthma attacks, allow individuals to discontinue oral glucocorticoids and decrease dose of inhaled steroids",Omalizumab
 can result in mild hemolytic anemia that resolve with warm temperatures and when IgM falls from initial infection,Cold agglutinins
" histologically, associated with hyalinization on alveolar membranes",ARDS / acute respiratory distress syndrome
 can acutely worsen subluxation of the cervical spinal cord (e.g. already present through RA),Endotrachial intubation
 all probabilities associated with independent events (e.g. multiple tests will not change these parameters),"PPV, NPV"
" this condition is associated with the ECG readings of NO P WAVES, narrow QRS complexes, irregularly irregular R-R intervals",Atrial fibrilation
 this part of the electrical conduction system of the heart determines the width of the QRS complex,Bundle branch conductivity
 is the main site of pacemaking in atrial fibrillation,Atrioventricular (AV) node
 useful modality for treating infertility; great at keeping elevated LH and FSH levels,Pulsatile GnRH
" useful modality for treating breast cancer, endometriosis, prostate cancer; great at keeping low LH and FSH after an initial spike",Continuous GnRH
" prevents PTH from being suppressed in response, which results in high serum Ca2+ with high to normal PTH levels",Familial hypocalciuric hypercalcemia
" occurs with stenosis of the subclavian artery proximal to the origin of the vertebral artery; presents asymptomatically, with arm ischemia, or with vertebrobasilar insufficiency; diagnosed via doppler ultrasound",Subclavian steal syndrome
 can present as retrograde flow on vertebral artery (due to other side being heavily stenotic),Subclavian steal syndrome
" in the kidney, is the GFR/RPF or renal plasma flow",Filtration fraction
 can be reduced with efferent arteriole constriction,Renal plasma flow
" this kidney flow state results in greatly increased oncotic pressure inside the glomerular capillaries, greatly limiting glomerular flow rate (GFR) despite increasing filtration fraction (FF)",Reduced renal plasma flow with severely constricted efferent arteriole
" this organ, innervated by 1b neurons, can sense muscle tension; when too much tension is present, these will induce sudden muscle relaxation",Golgi tendon organ
" this organ, innervated by 1a and 2-type neurons, are sensitive to muscle stretch for proprioception",Intrafusal muscle fibers
" can present with RBCs that ""lack central pallor"" on blood smear",Spherocytosis
" most sensitive strategy for screening for malabsorption disorders; example is ""Sudan III""",Staining stool for fat
 mitogen for fibroblast lines secreted by mast cells during times of anaphylaxis,Tryptase
 aka high-affinnity IgE receptor; found on mast cells; normally bind most IgE in circulation due to strong noncovalent bonding,FcERI
 caused by abnormal mitochondria accumulating underneath the sarcolemma of muscle fibers; associated with epilepsy (MERRF),Ragged red fiber myopathy
" 3 most important are - myoclonic epilepsy with ragged red fibers (MERRF), Leber optic neuropathy, and mitrochondrial encephalopathy with stroke-like episodes and lactic acidosis (MELAS)",Mitochondrial myopathies
 associated with increased nitrogen delivery to the gut in the form of Hb; this can cause hepatic encephalopathy in the setting of cirrhosis,Gastrointestinal bleeding
" state associated with accumulation of neurotoxins such  as ammonia; results in impaired inhibitory transmission, impaired excitatory neurotransmitter release",Hepatic encephalopathy
 anti-inflammatory cytokine produced by macrophages and Th2 cells to limit inflammatory cytokine release,IL-10
 can secrete a ACTH-like substance that causes Cushing's disease,Small-cell carcinoma of the lung
 hormone that exerts its effects on the medullary segment of the collecting duct,Vasopressin
" a circuit where a pulmonary artery and bronchial artery drains to a pulmonary vein, which in turn drains to the left atrium; aka normal physiologic shunting",Bronchial blood circuit
" can be divided into linker (H1) and core (H2,H3,H4) subtypes",Histones
 metabolic pH state that occurs with longer term high-altitudes,Respiratory alkalosis with metabolic compensation
  CGG repeat in this illness associated with hypermethylation and inactivation of its genes,Fragile X
 a highly-cellular and vascularized from which neurons and glial cells migrate out during development; common site for hemorrhage in prematurity,Germinal matrix
" the cruciate ligament inserting into the tibia posteriorly; originates from the *medial* condyle of the femur, anterolaterally",Posterior cruciate ligament
" can be caused by acute ischemia in posterior inferior cerebellar artery (a branch of the vertebral artery); associated with cerebellar ischemia, vertigo/nystagmus, ipsilateral cerebellar signs, loss of pain/temperature sensation in the ipsilateral face and contralateral body",Lateral medulary syndrome
" damage to this area of the brain in the temporal lobe will result in right or left homonymous superior quadrantanopia (""pie in the sky"")",Meyer's loop
 damage to the RIGHT optic tract caudal to the optic chiasm will result in this vision defect,Left homonymous hemianopia
Lesion in the LEFT dorsal optic radiation will result in this vision defect,"Right homonymous inferior quadrantanopia (""pie on the floor"")"
" in this procedure, immediately anterior to the esophagus is the left atrium; immediately posterior to the esophagus is the descending aorta",Transesophageal echocardiogram
" suggests sensitivity to trastuzumab, but at the same time, more aggressive cancer (instead of high progesterone or estrogen receptor expression)",Her2 overexpression
 these infections usually involve a period of immune-tolerant viral infection with normal liver testing; despite heavy replication of virus in liver,Perinatal Hepatitis B infection / anicteric Hepatitis A infection
 classical form of this disease is caused by a lack in UV-specific endonuclease involved in recognition and removal,Xeroderma pigmentosum
 familial cancer syndrome with Rb gene two-hit hypothesis; associated with osteosarcomas later in life,Familial retinoblastoma
" occurs acutely, decreases both GFR and FF because there is back-flow from the tubules",Acute urethral obstruction
 a test that uses specific antibodies and a fixed quantity of radiolabeled antigen to detect the amount of an antigen present in an unknown sample; this is done by measuring that amount of radiolabed antigen DISPLACED from the antibodies in the system,Radioimmunoassay
" associated with high levels of ""inhibin a"" and low alpha-fetoprotein in utero",Down syndrome
 stop codons; the last AA is added via the preceding codon on mRNA,"UGA, UAA, UAG"
" since this section of the rectum is more like colon, lymph drains following the colonic arterial system (e.g. internal iliac)",Lymphatic drainage of the rectum proximal to the dentate line
 this section of the rectum drains lymph towards the inguinal lymph nodes,Lymphatic drainage of the rectum distal to the dentate line
 most common cause of unilateral fetal hydronephrosis,Inadequate cannulization of the uretopelvic (ureter and kidney) junction
" this disease state can be divided into- congestion, red hepatization, gray hepatization, and resolution",Stages of pneumonia
" occurs during the first 24 hours of pneumonia; macroscopically, boggy, red; microscopically, mostly bacteria in exudate",Congestion phase of pneumonia
" occurs on day 2-3 of pneumonia; macroscopically, red, firm with liver-like consistency; microscopically, contains fresh RBCs, neutrophils, fibrin",Red hepatization phase of pneumonia
" occurs on day 4-6 of pneumonia; macroscopically, gray, brown firm lobe; microscopically, contains *lysed* RBCs, neutrophils, fibrin",Gray hepatization phase of pneumonia
" originates in the upper third of the iliac fossa (upper ridge of hip, medial side); flexes and medially rotates the thigh",Iliacus muscle
 originates at the transverse vertebral processes at T2-L5; combines with iliacus muscle for hip flexion,Psoas muscle
" can present with flank pain, gross hematuria, elevated lactate dehydrogenase",Renal infarction
" O2 is disproportionately affected relative to CO2, which has 20 times the ability to diffuse",Diffusion limited gas exchange
 104mmHg; compare to normal PaO2 which is around 100mmHg,Normal alveolar pO2 (PAO2)
 responsible for the shift in pain from umbilicus to McBurney's point in appendicitis,Progressive inflammation of the parietal peritoneum
" S2-S4, responsible for perineum sensory and urethral &amp; anal sphincter motor control",Pudendal nerve
" T12-L1, responsible for suprapubic sensory",Iliohypogastric nerve
" L1-L2 origin, responsible for sensory in scrotum/labia majora, medial thigh, as well as the cremasteric reflex",Genitofemoral nerve
" L2-L3 origin, responsible for sensory of anterior and lateral thigh",Lateral femoral cutaneous nerve
" in healthy, around 5-15mmHg, with older individuals having a slightly larger range due to reduced O2 diffusing capacity",A-a gradient
 this breathing state is noted by a low PaO2 with NORMAL A-a gradient,Hypoventilation
 this breathing state is noted by a low PaO2 with a LARGE A-a gradient,"V/Q mismatch, shunting, diffusion impairment"
" can present with watery diarrhea, colonic cell epithelial necrosis with fibrin deposition (colitis), yellow-white plaques on colon",Clostridium difficile
" mediated by T-cells and macrophages, this syndrome can develop over a day with cardiovascular collapse, hypotension, shock, fever, skin findings, multi-organ failure; usually caused by IL-1 and IL-2 release",Toxic shock syndrome
" describes which artery supplies the AV node; can be either one, the other, or both",Coronary artery dominance
 the state where the right coronary artery supplies the AV node,Right coronary artery dominant
 the state where the left circumflex artery supplies the AV node,Left coronary artery dominant
" caused by _reduced_ numbers of inhibitory ganglia, which results in decreased amplitude of peristalsis and incomplete relaxation at the LES; compare to CREST syndrome, where there will be decreased tone at the LES",Achalasia
 treatment of undescended testes involves passage of the testis through the superficial inguinal ring and fixing it to the scrotum,Orchiplexy
 aka the superficial inguinal ring,Opening in the external abdominal oblique aponeurosis
 aka the deep inguinal ring; located superior to the mid-inguinal point (between ASIS and pubic tubercle),Opening in the transversalis fascia
" process mediated by a Na+/Ca2+ exchange pump, and sarcoplasmic reticulum Ca2+ ATPase pump",Calcium efflux from cardiac cells prior to relaxation
 a Ca2+ binding messenger protein; useful for signal transduction AND for excitation-contraction coupling in smooth muscle cells,Calmodulin
