Empty,"TB is intracellular; thereby TH1 cells mediate the response with granulomas, stimulating formation of giant cells, etc."
Empty,"HIV begets superficial _candida_ infections, not systemic fungal ones"
Empty,_Legionella_ can be visualized on BYCE or silver stain; spread through water systems; a common cause of nosocomial pneumonia
Empty,"Viral tissue/cell affinity is generally determined by surface glycoproteins; other processes, such as endonucleases, proteases, etc. deal with affinity-independent viral replication"
" malaria, or babesiosis. Clinical presentations of both are similar; with babesiosis caused by ticks and malaria by mosquitos",Intra-RBC ring inclusions visualized in microscopy generally indicate one of two diseases
" fever, polyarthritis, macular rash. The polyarthritis and source separates it from similar Typhoid fever",_Aedes_ mosquito begets Dengue fever
Empty,"Ampicillin treats _Listeria_ infection, which can occur with eating soft cheeses or milk"
" hydrocephalus, intracranial calcifications, and choriorentinitis. Avoided by having mothers avoid cat feces.","Congenital toxoplasmosis is acquired in utero, characterized by"
 reduced GFR also reduces Na+ excretion; reduced Na+ excretion increases osmolarity of the blood; increased osmolarity of the blood increases volume; increased blood volume -> increased pressure,NSAIDS can contribute to high blood pressure via reducing GFR
Empty,"NSAIDs can also contribute acute nephritis, even causing papillary necrosis"
Empty,Allopurinol can cause DRESS syndrome; a systemic reaction with eosinophilia and systemic symptoms
Empty,Protein A from _S. aureus_ binds IgG at the Fc region to disable their function
 1) active infection and 2) >6 months following initial infection,HBsAg is the surface antigen for hepatitis B and will present during
Empty,"In hepatitis B infection, HBeAg is an indicator of infectivity, and will be positive during active infection"
" 1) ulcerative colitis, 2) sclerosing cholangitis, and 3) eosinophilic granulomatosis with polyangiitis",Antineutrophil cytoplasm antibodies (p-ANCA) are associated with
" type 2 hypersensitivity reaction to endogenous type IV collagen; primarily affects the basement membranes in the alveoli and glomeruli. If the glomerulus was sliced and visualized via immunofluorescence, a linear pattern of Ab deposition could be seen",Goodpasture syndrome
" hemoptysis, hematuria, smooth, linear pattern on IF, crescent formation under light microscopy",Symptoms &amp; signs of Goodpasture syndrome
 Deficiency of Th17 cells due to _STAT3_ mutation -> impaired neutrophil recruitment,Autosomal dominant hyper-IgE syndrome (Job syndrome)
Empty,IL-9 is produced by T-lymphocytes and plays a role in mast cell activation
Empty,"_Neisseria meningitidis_ infection can result in hypotension, tachycardia, and a rapidly enlarging pupuric rash"
 adrenal insufficiency,_Neisseria meningitidis_ can also cause gangrene of toes; and Waterhouse-Friderichsen syndrome (via hemorrhaging the adrenal glands)
" *Conjunctivitis, Coryza (stuffy nose), *C* ough. Also will have a rash spreading from head to toe, along with red lesions with white centers in the oral cavity",Measles is also known as Rubeola and is associated with the 3 C's
" in Rubella URI precedes rash, in *Rubeola* URI follows rash",Rubeola vs Rubella
Empty,"_Shigella_ is exremely virulent, only requiring &lt;100 organisms to seed clinical infection"
 osler nodes,Sign of subacute bacterial endocartitis (e.g. from viridians streptoccoci)
Empty,Theyer-Martin medium is used to culture _Neisseria gonorrhoeae_
Empty,_Dermacentor_ tick is responsible for transmitting _Rickettsia rickettsii_ and Rocky Mountain spotted fever
Empty,Antibodies for _Rickettsia rickettsii_ cross-react with the _Proteus_ antigen
 acute treatment is exchange Rh-positive blood with Rh-negative blood.,Rh mismatch
" intravascular is lysing of RBCs into plasma, EXTRAvascular is phagocytosis of RBCs by macrophages in spleen and liver",Intravascular vs. extravascular hemolysis
 Heberden nodes - hard bony swellings of the DIP,Osteoarthritis
" can't see (conjunctivitis), *can't pee* (urethritis), *can't bend my knee* (arthritis), *no anti-IgG*","Reactive arthritis, e.g. following _campylobacter_ infection"
 Ulnar deviation of hands is a late manifestation,Rheumatoid arthritis
 inactivating tumor suppressor genes such as _p53_ and _Rb_,HPV mechanism of oncogenesis
Empty,HIV-mediated immune suppression / dysregulation give rise to lymphomas and Kaposi's sarcoma
" in histology,characterized by broad-based budding yeast; endemic to Eastern states + Great Lakes; presents with flu-like symptoms + pleuritic chest pain",_Blastomyces dermatitidis_ is a fungus
Empty,Bacteremia or altered-mental status generally indicates *severe* infection and requires a stronger drug for treatment
Empty,"_Neisseria gonorrhoeae_ is a facultative intracellular gram-negative diplococci; due to its facultative intracellular nature, it can be detected via gram stain in urethral discharge"
" headache, nuchal rigidity (stiff neck)",Meningitis's characteristic signs
" results in subacute, sclerosing panencephalitis; a rare progessive demyelinating disease",Measles can cause a disease following 6-8 years of infection
" can result in inflammation of subQ fat called erythema nodosum. Can present as a rash on skin, with tender, subQ nodules. Mechanism unknown.",Inflammatory bowel diseases
" a chronic hardening / contraction of skin &amp; connective tissue, can be systemic or local. Often appears with other issues. CREST syndrome: Calcinosis, Raynaud phenomenon, Esophageal dysmotility, Scleroderma, Telangiectasias",Scleroderma
 spider veins,Telangiectasias
 intracellular junctions that connect epidermal cells to each other,Desmosomes
" Presents with raised blisters (tense bullae), and not shallow, flaccid blisters (e.g. pemphigus vulgaris). Disease due to anti-type XVII collagen Ab present in skin.",Bullous pemphigoid
" Presents with nonspecific fever, rash, and bone swelling. Disease due to too many histiocytes (e.g. macrophages of all kinds, dendritic cells). Characterized by proliferation of cells with tennis racket shaped-granules / coffee bean nuclei.",Histiocytosis
Empty,Glucocorticoids are indicated for acute injury to CNS to prevent excessive edema (further damage)
" acute inflammatory demyelnating polyradiculoneuropathy. Presents with fever from an initial infection, followed by ascending weakness/paralysis. Can be treated by prompt plasmapheresis, IgG to undo cross-reactive antibodies that bind myelin.",Guillian-Barre syndrome
 a result of gastric cancer. Leathery appearance of stomach in endoscopy.,Linitis plastica
 Marrow transplant is contraindicated due to functional T-cells,Bruton agammaglobulinemia
 can cause a parasitic infection that is not cyclic in nature,_Plasmodium falciparum_
" Transforming growth-factor beta dampens the immune response following higher levels of IL-1, and limiting TNF-alpha release by macrophages",Rheumatoid arthritis
" Self-limiting disease, caused by parvovirus B19. Presents as a fever, then a erythematous reticular rash that looks like ""slapped cheeks"". Worst-case, for those with sickle cell, can cause profound anemia due to infection in RBC precursors",Fifth disease
" Disseminated _Mycobacterium avium-intracellulare_, zoonotic, occurs at CD4+ <50 cells/mm^3. Prophylaxis is done with azithromycin at 50.",HIV
" Bacterial and fungal are the same opening pressure, protein, and glucose. Only difference: PMNs with bacteria, lymphocytes with fungi.",CSF Findings in Meningitis
" 150 opening pressure, <5 WBC, 35 protein",Normal CSF
" derpatitis, hepatitis, gastroenteritis.",Graft vs host disease
" Assositated with hypertense signal abnormalities in periventricular white matter, as well as clonally expanded IgG Abs in CSF",MS
 Failure of helper T lymphocytes to produce interferon-gamma,Job's Syndrome
 Rash in stage 1 disappears. In stage 2: Bell's palsy is not necessarily bilaterial. In stage 3: chronic polyarthritis is also common in addition to encephalitis.,Lyme disease
 Has a polyribosylribitol phosphate capsule,H. influenza
 Oxygen radicals that cause epithelial necrosis within the lung,Mycoplasma pneumoniae
 #1 cause of meningitis in neonates; Strep pneumo is #1 >6mo,Group B Strep
 Extracellular elementary bodies are the most infectious stage of chlamydia,Chlamydia trachomitis
" Auto Ab vs MPO, may present with pulmonary or renal involvement. Associated with saddle nose deformity and formation of necrotizing granulomas.",Microscopic polyangiitis (MPA)
" Rapid onset fever and symptoms. Can be spread through community water sources (e.g. air conditioner at a hotel, whirlpools, mist sprayers); Silver stain is yellow in background with brown organisms.",Legionnare's Disease
 Most common cause in children is _S. aureus_ followed by Group A strep,Impetigo
 Severe lower quadrant pain without gestational sac in uterus,Ectopic pregnancy
 Can ultimately result in retinal detachment with long-term infection secondary to necrosis,CMV Retinitis
22) Philadelphia translocation: Creates a constituatively active tyrosine kinase,t(9
 express a toxin via a temperate bacteriophage,C diptheriae and Group A Strep and S. Pyogenes
 Tick vector; Berry-like cytoplasmic inclusions in macrophages or neutrophils,ehrlichia chaffeensis
 Eosinic globules believed to be the result of hepatocyte apoptosis,Councilman bodies
 Treated with abendazole,Echinococcus Granulosus
" ""air-crescent sign in lungs, associated with reabsorption of necrotic tissue following invasive fungal infection""
*Cholangitis*: RUQ pain, jaundice, fever; with abdominal pain after eating; associated with long-standing gallstones
*Neurocysticercosis*: Tends to occur outside US with undercooked pork; but can manifest as focal neurologic deficits
*Viridians strep*: Bacterial endocarditis from prior mitral valve injury (such as from rheumatic fever) is possible
*Rickettsia rickettsii*: Rocky mountain spotted fever rash appears 2-5 days after the fever begins
*Pneumocystis jirovecii*: bronchioalveolar lavage can reveal foamy alveolar casts
*Heptatitis E*: Resembles hep A but much more severe in pregnant women
*C Tetani*: Neonatal infection of unclean umbilical stump is common in developing countries
*Haemophilus ducreyi*: Gram negative, coccobaccilis, chancroid forming bacteria
*Transduction vs transformation*: Transduction from bacteriophage (aka transfection); transformation from free environment
*Scarlet fever*: Not always acute, made of 1-2mm papular lesions (sandpaper) that tend to start at the neck then spread to the trunk. Spares the face, but strawberry tongue is part of it. Caused by Group A Strep (aka s. pyogenes erythrogenic toxins)
*Toxic shock syndrome*: From S. Aureus; causes widsepread erythroderma followed by desquamination 1-2 weeks later; acute ill with high fever and hypotension
*Hemolytic uremic syndrome*: E.coli O157:H7, and Shiga-toxin have the same MOA: inhibition of the 60s ribosomal subunit
*RSV*: bhronciolitis can appear as bad cold with wheezing, crackles on lung auscultation
*Post-strep glomerulonephritis*: Type III hypersensitivity reaction via deposition of antibody-antigen complexes in glomerular basement membrane, causing reaction
*Pseudomonas aeruginosa*: ventilator-associated pneumonia, usually after >48hrs of mechanical ventilation
*Macrolides*: Inhibit protein synthesis (translocation) by binding to the 50S ribosomal subunit
*Normal bacterial flora of the vagina*: Lactobacilli are keyh
*Haemophilus influenzae*: ""thumb sign"" as a result of highly inflamed cherry red epiglottis can be seen in X-ray
*H. pylori*: results in small, sharply demarcated erosions filled with nonspecific inflammatory infiltrate",Aspergillus
 Diagnosis can be through detection of antigen in a stool sample or liver abcess,Entamoeba histolytica
 first line therapy in the treatment of _Acinetobacter_ and _Enterobacter_ species,Carbapenems
" fever, sore throat, anterior cervical lypmhadenopathy, lack of cough; AKA stroptococcal pharyngitis",Strep throat
 most common cause of osteomyletis in asplenic patients as a whole; S. Aureus is common too,Salmonella
 single-stranded linear RNA virus,HTLV-1
 also associated with arthritis,Yellow fever
" classic presentation is high fever, flushing, erythematous mottling of the skin",Dengue fever
" Buboes can be described as ""exquisitely tender lymph nodes""; prolonged spread of Y. pestis can lead to DIC",Yersina pestis
" trismus = ""lockjaw""",Tetanus
 can cause lobar pneumonia in alcoholics and diabetics when aspirated,Klebsiella
 1st line therapy for Listeria and Enterococcus,Ampicillin
 common cause of anogenital squamous cell cancer,HPV-16
 common cause of anogenital lesions (condylomata acuminata),"HPV-11, HPV-6"
 e.g. from _B. cereus_ is supportive and does not require antibiotics,Exotoxin therapy
" single stranded positive sense RNA virus; hepevirus family, similar to picornovirus",Hep E
 has adherent pili that act as the primary virulence factor,N. gonorrhoeae
" can be described as erythematous papules on palms, or painful raised lesions on finger pads",Osler nodes
" Gram-positive, alpha-hemolytic, cocci in chains",Strep viridans
 testing for acute HIV includes HIV-1/HIV-2 antibody and p24 antigen immunoassays; ELISA followed by western blot does not detect acute HIV infection as well,HIV
" _S. aureus_ most common cause of pneumonia in CF patients under 20; where as >20 _P. aeruginosa_ predominates; in normal patients, _S. pneumoniae_ is the most common",S. aureus &amp; P. aeruginosa
" posterior lymphadenopathy can be described as ""enlarged cervical lymph nodes""; adenopathy can be described as ""erythematous tonsils w/o exudates""; and splenomegaly can be described as ""palpable spleen tip""",EBV
" common cause of transient hypothyroidism after several viral illnesses (e.g. mumps, EBV, coxsackie, flu, adenovirus)",De Quervain thyroiditis
" high fever, dysphagia, drooling, inspiratory stridor, respiratory distress can all describe inflammation of the epiglottis",Epiglottitis
" associated with HLA-B27, family history of psoriatic arhthritis; note *no anti-IgG Abs*",Reactive arthritis
 Vi antigen - protects it from opsonization and phagocytosis,Salmonella
 transmitted via fecal-oral route; human to human only,Shigella
 can be transmitted from domestic animals to humans,Campylobacter
 ecthyma gangrenosum is associated with P. aeruginosa bacteremia,Pseudomonas aeruginosa
 infection does not result in lasting immunity due to antigenic variation in outer membrane,N. gonorrhoeae
 usefil first line treatments for pseudomonas,Cefepime (3rd gen cephalosporin) and Cipro/Levo-floxacin
" can lead to hemolytic anemia due to ""I-antigen"" via molecular mimicry",Mycoplasma pneumoniae
 Biopsy of necrotic tissue is a good tool for diagnosis,Mucor
 Daily valacyclovir is good for preventing recurrent breakouts; initial weeklong course of acyclovir during the first episode tends to create room for healing and pain,HSV-2
 Uses antigenic pilli to adhere to nasopharynx epithelial cells,Neisseria meningititis
" can be described as ""continuous machinery murmur over the left infraclavicular area""",Patent arteriosus ductus &amp; congential Rubella
 can appear as cystic brain lesion with low enhancement in immunocompentent,Taenia &amp; Neurocysticercosis
 immobile; non-invasive; toxoid and IgG against toxoid is key clinically,Corynebacterium diptheriae
 macular diffuse rash that looks like measles,Morbilliform rash
" which includes cardiolipin, cholesterol, and lecithin, can be positive with infection of _T. pallidum_",Rapid plasma reagin (RPR) test
 meningitis caused by mumps is associated with parotitis (&amp; thus facial swelling),Mumps
 temporal encephalitis can lead to massive necrosis of the area,HSV-1
 pure viral pneumonias do not progress to bronchiectasis,Micro
" cough, asthma-like bronchospasm, hemoptysis, or transient pneumonia may be present; *transient* (no remodeling/bronchiectasis)",Strongyloides
 common cause of septic arthritis,N gonorrhoeae
" can be presented as ""severe pain and swelling; tenderness; microscopic analysis reveals an exudate with high neutrophil content""",Septic arthritis
 treatment is with ampicillin because it has altered penicillin-binding proteins,Listeria
 infection does not necessarily include mengingitis; can just result in Waterhouse-Friderichsen syndrome,N meningititis
" any type of abortion that results in infected retained products of contraception; commonly associated with fever, abdominal pain, uterine tenderness, foul-smelling discharge; associated with s. aureus",Septic abortion
 (aka typhoid fever) associated with hepatosplenomegaly due to invasive encapsulated organisms,Salmonella Typhi
" can be described as ""had a severe abdominal accident""; which has implications for infections",Asplenic
 anaerobic gram negative rods associated with aspiration pneumonia in alcoholics,Fusobacterium spp
 dextrans produced help viridians strep bind to the fibrin and platelet complexes near sites of endothelial trauma (e.g. damaged mitral valve) -> endocarditis,Viridans streptococci
" can be described as maculopapular rash, multiple purpuric lesions, and hepatomegaly; along with high fever, headaches, myalgias, joint pains",Dengue fever
 tinea capitis and other tinea forms can be spread through both human to human and animal to human contact,Tinea
 doubly refractile wall and a single broad-based bud,Blastomyces
 multiple painful superficial vesicles or ulcerations with an erythematous base; specific vesicles are _not always there_; ulcerations can be sole feature,HSV
" progressive, red serpigenous ulcerative lesions without lymphadenopathy",Klebsiella
 key term in describing the lesion: vesicular &amp; inflamed,HSV
 transmural inflammation of the blood vessels that can spare _pulmonary circulation_,Polyarteritis nodosa
 S1 from ventricular contraction -> closing of the mitral and tricuspid valves almost simultaneously; S2 from afterload pressure closing aortic and pulmonic valves while atria contract,S1 and S2 heart sounds
 Insufficiency = Regurgitation,Heart valve
 usually occurs a while after hepatitis B infections,Polyarteritis nodosa
 can cause chest pain and shortness of breath via embolic events,Endocarditis
" Patients with papillary muscle rupture (usually ~1 wk post-MI) will present with acute mitral insufficiency, causing heart failure; requires emergency surgery",MI
 associated with a perforated nasal septum,Wegner's disease / gramulomatosis with polyangiitis
" typically causes hypokalemia; on ECG, reads as peaked T-waves",Renal failure
 associated with cGMP GCPR system,Protein kinase C
 associated with cAMP GCPR system,Protein kinase A
 can still cause bradycardia due to alpha-agonism effects >> beta-agonism effects,Norepinephrine
" If myopathy is not well-tolerated, an alternative statin should be prescribed before switching to a new class of medication; this is because statins have relatively low side-effects relative to other classes of cholesterol-lowering drugs",Statins
 Troponin takes a few hours to accumulate in blood; therefore ECG is the fastest in terms of diagnosing MI,Troponin / ECG
 caused by lipofuscin accumulation; lipofuscin is a non-degradable pigment formed from an iron-catalyzed oxidative process from autophagocytosed organelles;  normally present in the body with age,Brown atrophy of heart
 DVT -> pulmonary; generally not seen in states such as MI unless septal defect present; A-fib can generate emboli that can shower into coronary circulation,Thromboembolic disease in cardiac
 non-focal scarring/weakening of the aorta that can cause aneurysm / rupture,Tree-bark aorta with syphillis
" associated with small, verrucous vegetations on the mitral valve",Libman-Sacks endocarditis
" in addition to the conjunctivitis, rash, and strawberry tongue, there is often a cervical adenopathy",Kawasaki disease
" Although they are the main site for generating systemic peripheral resistance in blood flow, they are not the site of the significant turbulence necessary to presdispose to atherosclerotic formation",Atherosclerosis
" can cause ""fish mouth"" deformation of the mitral valve -> regurgitation/insufficiency",Rheumatic heart disease
" in 50% of patients, occurs with polymyalgia rheumatica, an illness associated with symmetrical aching of proximal muscles and girdle stiffness",Giant cell arteritis
 upwards dissection (into the aortic arch) can result in asymmetric pulses where the right brachiocephalic artery may be affected while sparing the left subclavian; can result in pericardial tamponade,Acute aortic dissection
" associated with symptoms of chronic disease (malaise, low-grade fever, weight loss) in addition to valvular damage",Endocarditis
 occurs near the site of infarction,Cardiac free-wall rupture
 almost exclusively seen in adults; located in the atraia,Cardiac myxomas
" Beta-2 helps to dilate peripheral vessels in smooth muscle, skeletal muscle, pulmonary muscle, and coronary vessels",Adrenergic drugs
 excessive nitrate exposure results in venodilation; venodilation from nitrates can be unopposed (e.g. without compensatory vasoconstriction) in critical areas such as the coronary arteries resulting in cardiac ischemia,Monday disease
 therapeutic range is around 2-3,Warfarin INR
" is a nonselective Beta-antagonist, therefore not suitable for use in patients with asthma",Sotalol
 associated with other vasospastic diseases such as migraines and/or Raynaud,Prinzmetal angina
" drug-induced lupus is associated with serositis, which can present with sharp chest pain that does not radiate or change with movement, nothing may lessen the pain; drug-induced lupus is also associated with arthralgias, myalgias, and fatigue",SLE
 S4 sound caused by stiffness of hypertrophied ventricle; can be caused by HCM,Heart murmurs
 can be treated with amiodarone and sotalol,Ventricular tachycardia
" commonly asymptomatic; but assoc with male sex, Marfan, Ehlers-Danlos, inflammatory conditions",Thoracic aortic aneurysms
" pulsus paradoxus can present as ""diminishing heart sounds on inspiration""",Cardiac tamponade
 neonatal cyanosis; can be visualized in chest x-ray via a narrow mediastinum with an egg-shaped heart,Transposition of the great vessels
 S3 heart sound caused by overly-compliant left ventricle (e.g. dilated left ventricle),Heart murmurs
 not associated with tearing chest/back pain; that is with dissection; affects all layers of the aorta and does not form a false lumen,Ruptured abdominal aortic aneurysm
" can present without exertion, characterized by a *delta* wave on ECG, which replaces Q wave, shortened PR, widened QRS",Wolf-Parkinson-White syndrome
 blowing while holding nose closed; increases abdominal pressure -> reduce preload; this results in worsening of mitral valve prolapse (and not others),Valsalva maneuver
 can induce a lupus-like syndrome; presented as antihistone antibodies,Hydralazine
 large decrease in BP with inspiration; can be presented as 1st Kortokoff sound only being heard with high cuff pressure; 1st/2nd Kortokoff sound being heard with deflated cuff,Pulsus paradoxus
 lesions can be of varying stages; associated with Type III hypersensitivity,Polyartrertitis nodosa
" associated with palpable purpura, associated with MPO-ANCA along with p-ANCA; no asthma/nervous (differentiates from Churg-Strauss)",Microscopic polyangiitis
 amioderone is a commonly used treatment prior to class 1A antiarrythmics,Wolf-Parkinson-White Syndrome
 competitively inhibits HMG CoA reductase,Statins
 3-hydroxy-3-methylglutaryl coenzyme A (is AKA HMG CoA reductase),Statins
 last-resort blood pressure medication that can be given transdermally,Clonidine
 last-resort high blood pressure medication that can be given transdermally; alpha-2 antagonist,Clonidine
 has greatest effect on phase 0 of SA nodal tissue,Verapamil
 amlodipine - nifedipine > diltiazem > verapamil,Vascular smooth muscle relaxation/contractility
 closer to muscle in cell morphology the faster it conducts; Purkinje > Bundle of His > AV node,Conduction velocity of heart tissue
 respond to lower pressures vs. aortic arch baroreceptors; reduced activation leads to greater sympathetic outflow,Carotid baroreceptors
 voltage gated; not ligand gated; ligand gated are slower and are present in other areas such as nicotinic acetylcholine receptors,Ion channels in myocardium
 most common site of infective endocarditis in intravenous drug users,Tricuspid valve murmur
 is always maximized and unchanging,Oxygen extraction from heart muscle
" local hypoxia during exercise causes release of local metabolites (NO, adenosine, CO2) which *dilate* coronary arteries",Myocardio oxygen balance
" conduction speed within the heart; mostly controlled in AV node, via Beta-1 adrenergic receptor activation",Dromotropy
" can occur after radiation, trauma, or other chronic illness",Constriction pericarditis
 can be presented as an inverse R-R interval on ECG,Heart rate
 Central venous pressure and pulmonary capillary wedge pressure generally correlate with each other in terms of increase/decrease,Shock
 alpha 2 stimulation reduces sympathetic outflow; ultimately decreasing blood pressure,Alpha-2 adrenoreceptor
" ""Pomp trashes the pump""; nonfunctional alpha-1,4 glucosidase resulting in inability to break down glycogen -> cardiomyopathy",Pompe disease
" the third aortic arch, AKA the ""carotid arch""",Embryology of carotid artery
 the 4th aortic arch,Embryology of the aortic arch
 can be heard as a harsh holosystolic murmur in tricuspid area,Ventricular septal defect
 supplies the vertebral artery,Subclavian artery
